{"$id":"candidate-runtime-metadata.v0.schema.json","$schema":"https://json-schema.org/draft/2020-12/schema","additionalProperties":false,"properties":{"artifact":{"additionalProperties":false,"properties":{"expectedByteLengthState":{"const":"unknown-not-requested"},"expectedSha256State":{"const":"unknown-not-requested"},"fileName":{"minLength":1,"pattern":".*\\S.*","type":"string"},"locatorImmutable":{"const":false},"locatorState":{"enum":["official-drive-folder-resolved-object-and-hash-unresolved","official-release-url-resolved-by-fixed-hubconf-bytes-unpinned"]},"officialLocator":{"minLength":1,"pattern":".*\\S.*","type":"string"},"repositoryStorageAllowed":{"const":false},"requestState":{"const":"no-head-no-get-no-bytes"}},"required":["fileName","locatorState","officialLocator","locatorImmutable","expectedByteLengthState","expectedSha256State","requestState","repositoryStorageAllowed"],"type":"object"},"authorization":{"additionalProperties":false,"properties":{"bodyGetAuthorized":{"const":false},"checkpointLoadAuthorized":{"const":false},"dependencyInstallAuthorized":{"const":false},"inferenceAuthorized":{"const":false},"metadataHeadAuthorized":{"const":false},"naturalImageAuthorized":{"const":false},"productUseAuthorized":{"const":false}},"required":["metadataHeadAuthorized","bodyGetAuthorized","dependencyInstallAuthorized","checkpointLoadAuthorized","inferenceAuthorized","naturalImageAuthorized","productUseAuthorized"],"type":"object"},"candidateId":{"enum":["REG-MATTE-MODNET@0.1.0","REG-MATTE-RVM-MOBILENETV3@0.1.0"]},"contentHash":{"pattern":"^[a-f0-9]{64}$","type":"string"},"dependencies":{"additionalProperties":false,"properties":{"declarationState":{"enum":["partial-unpinned-import-and-demo-declarations","fixed-requirements-file-plus-broad-hubconf-declaration"]},"declaredDirect":{"items":{"minLength":1,"pattern":".*\\S.*","type":"string"},"minItems":1,"type":"array"},"installedCount":{"const":0},"operationSpecificLock":{"const":false},"packageHashState":{"const":"not-created"},"platformWheelSetState":{"const":"not-selected"},"pythonExactVersionState":{"const":"not-selected"},"sbomState":{"const":"not-created"},"transitiveLockState":{"const":"not-created"}},"required":["declarationState","declaredDirect","operationSpecificLock","pythonExactVersionState","platformWheelSetState","transitiveLockState","packageHashState","sbomState","installedCount"],"type":"object"},"evidenceBoundary":{"additionalProperties":false,"properties":{"c1":{"const":0},"e1":{"const":0},"g1":{"const":0},"o1":{"const":0},"productSupport":{"const":false},"r1Pipeline":{"const":0},"r1ProductRelease":{"const":0},"r1ProductValidation":{"const":0},"u1":{"const":0},"v1":{"const":0}},"required":["c1","u1","e1","r1Pipeline","r1ProductValidation","r1ProductRelease","o1","g1","v1","productSupport"],"type":"object"},"frozenAt":{"pattern":"^20[0-9]{2}-[0-9]{2}-[0-9]{2}T[0-9]{2}:[0-9]{2}:[0-9]{2}\\.[0-9]{3}Z$","type":"string"},"license":{"additionalProperties":false,"properties":{"officialFileSha256":{"pattern":"^[a-f0-9]{64}$","type":"string"},"productDistributionState":{"const":"blocked-pending-independent-review"},"scopeObservation":{"minLength":1,"pattern":".*\\S.*","type":"string"},"spdx":{"enum":["Apache-2.0","GPL-3.0-only"]}},"required":["spdx","officialFileSha256","scopeObservation","productDistributionState"],"type":"object"},"loading":{"additionalProperties":false,"properties":{"approvedLoaderState":{"const":"not-implemented"},"automaticDownloadPresent":{"type":"boolean"},"networkAtRuntime":{"const":"disabled"},"officialPattern":{"minLength":1,"pattern":".*\\S.*","type":"string"},"remoteCodeAllowed":{"const":false},"singleImageContractObservation":{"minLength":1,"pattern":".*\\S.*","type":"string"},"unsafePickleCompatibleCallPresent":{"const":true}},"required":["officialPattern","automaticDownloadPresent","unsafePickleCompatibleCallPresent","singleImageContractObservation","approvedLoaderState","networkAtRuntime","remoteCodeAllowed"],"type":"object"},"metadataId":{"minLength":1,"pattern":".*\\S.*","type":"string"},"officialFiles":{"items":{"additionalProperties":false,"properties":{"bodyClass":{"const":"source-metadata-text-not-model-bytes"},"byteLength":{"maximum":1000000,"minimum":1,"type":"integer"},"commit":{"pattern":"^[a-f0-9]{40}$","type":"string"},"purpose":{"minLength":1,"pattern":".*\\S.*","type":"string"},"sha256":{"pattern":"^[a-f0-9]{64}$","type":"string"},"sourceObservationRecordedAt":{"pattern":"^20[0-9]{2}-[0-9]{2}-[0-9]{2}T[0-9]{2}:[0-9]{2}:[0-9]{2}\\.[0-9]{3}Z$","type":"string"},"url":{"minLength":1,"pattern":".*\\S.*","type":"string"}},"required":["purpose","url","commit","byteLength","sha256","sourceObservationRecordedAt","bodyClass"],"type":"object"},"maxItems":5,"minItems":3,"type":"array"},"schemaVersion":{"const":"candidate-runtime-metadata.v0"},"state":{"const":"official-source-metadata-resolved-runtime-not-selected-artifact-not-requested"},"unresolvedBlockers":{"items":{"minLength":1,"pattern":".*\\S.*","type":"string"},"minItems":1,"type":"array"},"upstream":{"additionalProperties":false,"properties":{"commit":{"pattern":"^[a-f0-9]{40}$","type":"string"},"refKind":{"enum":["branch","tag"]},"refName":{"minLength":1,"pattern":".*\\S.*","type":"string"},"repository":{"minLength":1,"pattern":".*\\S.*","type":"string"},"retrievalDate":{"const":"2026-08-16"}},"required":["repository","refKind","refName","commit","retrievalDate"],"type":"object"}},"required":["schemaVersion","metadataId","frozenAt","candidateId","state","upstream","officialFiles","artifact","dependencies","loading","license","unresolvedBlockers","authorization","evidenceBoundary","contentHash"],"type":"object"}
