{"artifact":{"expectedByteLengthState":"unknown-not-requested","expectedSha256State":"unknown-not-requested","fileName":"rvm_mobilenetv3.pth","locatorImmutable":false,"locatorState":"official-release-url-resolved-by-fixed-hubconf-bytes-unpinned","officialLocator":"https://github.com/PeterL1n/RobustVideoMatting/releases/download/v1.0.0/rvm_mobilenetv3.pth","repositoryStorageAllowed":false,"requestState":"no-head-no-get-no-bytes"},"authorization":{"bodyGetAuthorized":false,"checkpointLoadAuthorized":false,"dependencyInstallAuthorized":false,"inferenceAuthorized":false,"metadataHeadAuthorized":false,"naturalImageAuthorized":false,"productUseAuthorized":false},"candidateId":"REG-MATTE-RVM-MOBILENETV3@0.1.0","contentHash":"08ed24e7288ff97b409c59fe8d9d2e6e5453d8680c1b7f9d8150a2bb53c796c7","dependencies":{"declarationState":"fixed-requirements-file-plus-broad-hubconf-declaration","declaredDirect":["av==8.0.3","torch==1.9.0","torchvision==0.10.0","tqdm==4.61.1","pims==0.5","hubconf dependencies: torch and torchvision without versions"],"installedCount":0,"operationSpecificLock":false,"packageHashState":"not-created","platformWheelSetState":"not-selected","pythonExactVersionState":"not-selected","sbomState":"not-created","transitiveLockState":"not-created"},"evidenceBoundary":{"c1":0,"e1":0,"g1":0,"o1":0,"productSupport":false,"r1Pipeline":0,"r1ProductRelease":0,"r1ProductValidation":0,"u1":0,"v1":0},"frozenAt":"2026-08-16T03:46:26.424Z","license":{"officialFileSha256":"8b1ba204bb69a0ade2bfcf65ef294a920f6bb361b317dba43c7ef29d96332b9b","productDistributionState":"blocked-pending-independent-review","scopeObservation":"fixed repository license is GPL version 3; product distribution remains outside this research-only definition","spdx":"GPL-3.0-only"},"loading":{"approvedLoaderState":"not-implemented","automaticDownloadPresent":true,"networkAtRuntime":"disabled","officialPattern":"hubconf may call torch.hub.load_state_dict_from_url; README local path uses torch.load then load_state_dict","remoteCodeAllowed":false,"singleImageContractObservation":"official example initializes four recurrent states to None and a single frame call returns foreground, alpha, and four next recurrent states","unsafePickleCompatibleCallPresent":true},"metadataId":"META-MATTE-RVM-RUNTIME@0.1.0","officialFiles":[{"bodyClass":"source-metadata-text-not-model-bytes","byteLength":11178,"commit":"17d1774b032fd503bfe53c57d295db719f9e3da1","purpose":"repository inference and single-frame recurrent-state example","sha256":"622b340807bd9106a5de7fa03d4df59457f87f2c3f893cd586a14cd6391d7b0b","sourceObservationRecordedAt":"2026-08-16T03:46:26.424Z","url":"https://github.com/PeterL1n/RobustVideoMatting/raw/17d1774b032fd503bfe53c57d295db719f9e3da1/README.md"},{"bodyClass":"source-metadata-text-not-model-bytes","byteLength":1283,"commit":"17d1774b032fd503bfe53c57d295db719f9e3da1","purpose":"TorchHub dependency and fixed release locator","sha256":"dd0ba81acb5fc4a2390a5d152df9d869a285b46ac47190fa0e7ffebc766469f2","sourceObservationRecordedAt":"2026-08-16T03:46:26.424Z","url":"https://github.com/PeterL1n/RobustVideoMatting/raw/17d1774b032fd503bfe53c57d295db719f9e3da1/hubconf.py"},{"bodyClass":"source-metadata-text-not-model-bytes","byteLength":65,"commit":"17d1774b032fd503bfe53c57d295db719f9e3da1","purpose":"published inference direct dependency pins","sha256":"b4ab4ff64ec6dd825a83ff438292b7e3dc62f662367a44f26d84fa44e5028a50","sourceObservationRecordedAt":"2026-08-16T03:46:26.424Z","url":"https://github.com/PeterL1n/RobustVideoMatting/raw/17d1774b032fd503bfe53c57d295db719f9e3da1/requirements_inference.txt"},{"bodyClass":"source-metadata-text-not-model-bytes","byteLength":3091,"commit":"17d1774b032fd503bfe53c57d295db719f9e3da1","purpose":"network forward signature and recurrent state contract","sha256":"d8378170659fd21d114096120f9a0ad2fed0550c4d4664927d68f2def3ccd960","sourceObservationRecordedAt":"2026-08-16T03:46:26.424Z","url":"https://github.com/PeterL1n/RobustVideoMatting/raw/17d1774b032fd503bfe53c57d295db719f9e3da1/model/model.py"},{"bodyClass":"source-metadata-text-not-model-bytes","byteLength":35148,"commit":"17d1774b032fd503bfe53c57d295db719f9e3da1","purpose":"repository GPL-3.0 license","sha256":"8b1ba204bb69a0ade2bfcf65ef294a920f6bb361b317dba43c7ef29d96332b9b","sourceObservationRecordedAt":"2026-08-16T03:46:26.424Z","url":"https://github.com/PeterL1n/RobustVideoMatting/raw/17d1774b032fd503bfe53c57d295db719f9e3da1/LICENSE"}],"schemaVersion":"candidate-runtime-metadata.v0","state":"official-source-metadata-resolved-runtime-not-selected-artifact-not-requested","unresolvedBlockers":["release artifact byte length and SHA-256 not captured","Python version and platform wheel set not selected","published requirements do not pin transitive packages or wheel hashes","safe checkpoint loader and negative tests absent","single-frame adapter and hardware/resource profile absent","GPL distribution review unresolved"],"upstream":{"commit":"17d1774b032fd503bfe53c57d295db719f9e3da1","refKind":"tag","refName":"v1.0.0","repository":"https://github.com/PeterL1n/RobustVideoMatting","retrievalDate":"2026-08-16"}}
